Sheet: progress_sheet_bulk_upload_gene
A1: Student SR No | B1: First Name | C1: Last Name | D1: Class | E1: Exam | F1: Subject | G1: Max Marks | H1: Passing Marks | I1: Scored Marks
A2: 123abc | B2: Copa | D2: Std 1 A | E2: Class Test 1 | F2: English | H2: 40 | I2: 69
A3: 123abc | B3: Copa | D3: Std 1 A | E3: Class Test 1 | F3: Hindi | G3: 100 | I3: 87
A4: 123abc | B4: Copa | D4: Std 1 A | E4: Class Test 1 | F4: Mathamatics | G4: 100 | H4: 40
A5: 123abc | B5: Copa | D5: Std 1 A | E5: Class Test 1 | F5: EVS | G5: 100 | H5: 40 | I5: =(R[-1]C+R[-2]C)/2 -> 43.5
A6: 123abc | B6: Copa | D6: Std 1 A | E6: Class Test 1 | F6: Physical Education | G6: 100 | H6: 40 | I6: =(R[-1]C+R[-2]C)/2 -> 21.75
A7: ABC111 | B7: Rakesh | D7: Std 1 A | E7: Class Test 1 | F7: EVS | G7: 100 | H7: 40 | I7: =(R[-1]C+R[-2]C)/2 -> 32.625
A8: ABC111 | B8: Rakesh | D8: Std 1 A | E8: Class Test 1 | F8: Physical Education | G8: 100 | H8: 40 | I8: 87
A9: ABC111 | B9: Rakesh | D9: Std 1 A | E9: Class Test 1 | F9: English | G9: 100 | H9: 40 | I9: =(R[-1]C+R[-2]C)/2 -> 59.8125
A10: ABC111 | B10: Rakesh | D10: Std 1 A | E10: Class Test 1 | F10: Hindi | G10: 100 | H10: 40 | I10: 54
A11: ABC111 | B11: Rakesh | D11: Std 1 A | E11: Class Test 1 | F11: Mathamatics | G11: 100 | H11: 40 | I11: 87
A12: ABC133 | B12: Gaurav | C12: gauravk | D12: Std 1 A | E12: Class Test 1 | F12: English | G12: 100 | H12: 40 | I12: =(R[-1]C+R[-2]C)/2 -> 70.5
A13: ABC133 | B13: Gaurav | C13: gauravk | D13: Std 1 A | E13: Class Test 1 | F13: Hindi | G13: 100 | H13: 40 | I13: =(R[-1]C+R[-2]C)/2 -> 78.75
A14: ABC133 | B14: Gaurav | C14: gauravk | D14: Std 1 A | E14: Class Test 1 | F14: Mathamatics | G14: 100 | H14: 40 | I14: =(R[-1]C+R[-2]C)/2 -> 74.625
A15: ABC133 | B15: Gaurav | C15: gauravk | D15: Std 1 A | E15: Class Test 1 | F15: EVS | G15: 100 | H15: 40 | I15: 54
A16: ABC133 | B16: Gaurav | C16: gauravk | D16: Std 1 A | E16: Class Test 1 | F16: Physical Education | G16: 100 | H16: 40 | I16: 87
A17: ABC147 | B17: Nishant | C17: nishantm | D17: Std 1 A | E17: Class Test 1 | F17: English | G17: 100 | H17: 40 | I17: =(R[-1]C+R[-2]C)/2 -> 70.5
A18: ABC147 | B18: Nishant | C18: nishantm | D18: Std 1 A | E18: Class Test 1 | F18: Hindi | G18: 100 | H18: 40 | I18: =(R[-1]C+R[-2]C)/2 -> 78.75
A19: ABC147 | B19: Nishant | C19: nishantm | D19: Std 1 A | E19: Class Test 1 | F19: Mathamatics | G19: 100 | H19: 40 | I19: 87
A20: ABC147 | B20: Nishant | C20: nishantm | D20: Std 1 A | E20: Class Test 1 | F20: EVS | G20: 100 | H20: 40 | I20: =(R[-1]C+R[-2]C)/2 -> 82.875
A21: ABC147 | B21: Nishant | C21: nishantm | D21: Std 1 A | E21: Class Test 1 | F21: Physical Education | G21: 100 | H21: 40 | I21: 54
A22: ABC149 | B22: Shraddha | D22: Std 1 A | E22: Class Test 1 | F22: English | G22: 100 | H22: 40 | I22: 87
A23: ABC149 | B23: Shraddha | D23: Std 1 A | E23: Class Test 1 | F23: Hindi | G23: 100 | H23: 40 | I23: =(R[-1]C+R[-2]C)/2 -> 70.5
A24: ABC149 | B24: Shraddha | D24: Std 1 A | E24: Class Test 1 | F24: Mathamatics | G24: 100 | H24: 40 | I24: =(R[-1]C+R[-2]C)/2 -> 78.75
A25: ABC149 | B25: Shraddha | D25: Std 1 A | E25: Class Test 1 | F25: EVS | G25: 100 | H25: 40 | I25: =(R[-1]C+R[-2]C)/2 -> 74.625
A26: ABC149 | B26: Shraddha | D26: Std 1 A | E26: Class Test 1 | F26: Physical Education | G26: 100 | H26: 40 | I26: 54